{
  "schema_version": 1,
  "package_id": "dog-nose",
  "provider": "viewmade",
  "provider_endpoint": "https://mcp.viewmade.com/mcp",
  "status": "NOT_SUBMITTED",
  "submission_allowed": false,
  "blocked_reason": null,
  "preflight": {
    "tool_bindings_complete": true,
    "authentication": "not_checked_by_build",
    "live_authorisation": "required_at_render_time"
  },
  "request": {
    "title": "Why a Dog's Nose Works in Stereo",
    "provider_topic": "How does a dog's nose separate smelling from breathing?",
    "format": "youtube_shorts",
    "duration_s": 45,
    "aspect_ratio": "9:16",
    "resolution": "1080x1920",
    "language": "en",
    "narration": "A dog's nose splits air into two jobs. When a dog sniffs, air does not take one simple path through the nose. It splits. A 2010 study built a computer model of a dog's nasal airway from MRI scans. The simulation showed two separate flows: one for breathing, and one that carries odor molecules to the olfactory region. Each nostril also draws from its own patch of air, because the nose's reach is smaller than the gap between the nostrils. That may help a dog compare scent strength on each side. The nose is a routing system, not just a detector. Its shape helps scent reach the receptors.",
    "scenes": [
      {
        "id": "s1",
        "start_s": 0,
        "duration_s": 2.5,
        "narration": "A dog's nose splits air into two jobs.",
        "visual": {
          "description": "A black Labrador mix with a graying muzzle lowers its nose to a fallen leaf on a garden path. The camera frames the snout and one relaxed eye, with soft green foliage blurred behind. The dog sniffs calmly and lifts its head slightly.",
          "shot_type": "low-angle close-up",
          "subject": "one black Labrador mix with a graying muzzle and a glossy black nose",
          "motion": "slow push-in as the dog sniffs the leaf",
          "framing": "vertical 9:16, nose in the lower middle third, eye on the upper-third line",
          "continuity": "same black dog, red collar, and garden path in every scene",
          "avoid": [
            "human face",
            "leash tugging",
            "wet or injured nose",
            "text overlays"
          ]
        },
        "transition": "cut"
      },
      {
        "id": "s2",
        "start_s": 2.5,
        "duration_s": 7.5,
        "narration": "When a dog sniffs, air does not take one simple path through the nose. It splits.",
        "visual": {
          "description": "The same black dog holds its nose close to the leaf while two faint, translucent ribbons of air curl toward the nostrils. One ribbon rises along the upper snout, the other runs lower. The dog stays still and curious, and the garden light is soft.",
          "shot_type": "macro three-quarter view of the snout",
          "subject": "the same black dog's nose and muzzle, with two abstract airflow ribbons",
          "motion": "very slow lateral drift; the ribbons divide and settle",
          "framing": "vertical 9:16, nostrils centered, ribbons flowing into the upper and lower thirds",
          "continuity": "same glossy nose, graying muzzle, and red collar edge",
          "avoid": [
            "smoke",
            "fire",
            "human hands",
            "text overlays"
          ]
        },
        "transition": "cut"
      },
      {
        "id": "s3",
        "start_s": 10.0,
        "duration_s": 8.0,
        "narration": "A 2010 study built a computer model of a dog's nasal airway from MRI scans.",
        "visual": {
          "description": "A translucent, glass-like model of a dog's head rotates slowly above a dark studio surface. The snout is anatomically correct, and a soft amber light suggests the internal nasal airway without opening the body. No labels or readable marks appear.",
          "shot_type": "studio product-style medium shot",
          "subject": "one translucent canine head model with a detailed snout",
          "motion": "slow orbital rotation, then a gentle hold",
          "framing": "vertical 9:16, model centered with generous dark negative space",
          "continuity": "same amber palette and dark background throughout the model sequence",
          "avoid": [
            "dissection",
            "blood",
            "medical labels",
            "text overlays"
          ]
        },
        "transition": "cut"
      },
      {
        "id": "s4",
        "start_s": 18.0,
        "duration_s": 8.0,
        "narration": "The simulation showed two separate flows: one for breathing, and one that carries odor molecules to the olfactory region.",
        "visual": {
          "description": "An abstract view of two smooth ribbons of light moving through a dark amber space. The upper ribbon curves toward the rear and slows into a fine mesh; the lower ribbon runs straighter and wider toward the throat. The shapes are non-literal and unlabeled.",
          "shot_type": "abstract macro animation",
          "subject": "two separate airflow ribbons, one high and narrow, one low and broad",
          "motion": "slow forward drift; the upper ribbon spreads into a delicate mesh",
          "framing": "vertical 9:16, both ribbons centered with clear separation",
          "continuity": "same amber palette, grain, and dark background as the model scene",
          "avoid": [
            "readable characters",
            "medical diagram",
            "flashing lights",
            "text overlays"
          ]
        },
        "transition": "cut"
      },
      {
        "id": "s5",
        "start_s": 26.0,
        "duration_s": 9.0,
        "narration": "Each nostril also draws from its own patch of air, because the nose's reach is smaller than the gap between the nostrils.",
        "visual": {
          "description": "A front macro view of the same black dog's nose. Two separate pale ribbons curl in from different directions, one toward each nostril, with a clear gap between them. The muzzle is relaxed and the whiskers are still.",
          "shot_type": "front macro close-up",
          "subject": "the same black dog's two nostrils and muzzle, with two separate air ribbons",
          "motion": "static camera; the ribbons pulse gently inward",
          "framing": "vertical 9:16, nose centered, one ribbon entering from each side",
          "continuity": "same glossy nose, graying muzzle, and red collar edge",
          "avoid": [
            "merged nostrils",
            "smoke",
            "human hands",
            "text overlays"
          ]
        },
        "transition": "cut"
      },
      {
        "id": "s6",
        "start_s": 35.0,
        "duration_s": 10.0,
        "narration": "That may help a dog compare scent strength on each side. The nose is a routing system, not just a detector. Its shape helps scent reach the receptors.",
        "visual": {
          "description": "The same black dog stands on the garden path beside an owner's open hand, nose lifted toward a light breeze. The dog's posture is relaxed and its tail is loose. The camera pulls back slowly to reveal the green garden, then fades.",
          "shot_type": "medium shot, then slow pull-back",
          "subject": "the same black dog and an owner's open hand",
          "motion": "slow pull-back; the dog lifts its nose and holds",
          "framing": "vertical 9:16, dog in the lower middle third, open garden above",
          "continuity": "same dog, red collar, garden path, and soft daylight; no other animals",
          "avoid": [
            "human face",
            "leash tugging",
            "hybrid animals",
            "text overlays"
          ]
        },
        "transition": "fade out"
      }
    ],
    "captions": {
      "mode": "burned_in",
      "srt_file": "subtitles.srt",
      "cues": [
        {
          "index": 1,
          "start_s": 0.0,
          "end_s": 2.5,
          "text": "A dog's nose splits air into two jobs."
        },
        {
          "index": 2,
          "start_s": 2.5,
          "end_s": 9.062,
          "text": "When a dog sniffs, air does not take one simple path through the nose."
        },
        {
          "index": 3,
          "start_s": 9.062,
          "end_s": 10.0,
          "text": "It splits."
        },
        {
          "index": 4,
          "start_s": 10.0,
          "end_s": 18.0,
          "text": "A 2010 study built a computer model of a dog's nasal airway from MRI scans."
        },
        {
          "index": 5,
          "start_s": 18.0,
          "end_s": 22.0,
          "text": "The simulation showed two separate flows: one for breathing,"
        },
        {
          "index": 6,
          "start_s": 22.0,
          "end_s": 26.0,
          "text": "and one that carries odor molecules to the olfactory region."
        },
        {
          "index": 7,
          "start_s": 26.0,
          "end_s": 30.35,
          "text": "Each nostril also draws from its own patch of air, because"
        },
        {
          "index": 8,
          "start_s": 30.35,
          "end_s": 35.0,
          "text": "the nose's reach is smaller than the gap between the nostrils."
        },
        {
          "index": 9,
          "start_s": 35.0,
          "end_s": 38.784,
          "text": "That may help a dog compare scent strength on each side."
        },
        {
          "index": 10,
          "start_s": 38.784,
          "end_s": 42.162,
          "text": "The nose is a routing system, not just a detector."
        },
        {
          "index": 11,
          "start_s": 42.162,
          "end_s": 45.0,
          "text": "Its shape helps scent reach the receptors."
        }
      ]
    },
    "voice": "natural English narration, warm and measured",
    "music": "subtle, low, non-distracting documentary bed",